{
  "schemaVersion": "1.0",
  "testCaseId": "football-live",
  "content": {
    "contentId": "live-football-001",
    "contentType": "LIVE"
  },
  "annotations": [
    {
      "annotationId": "football-live-0001",
      "window": {
        "startMs": 0,
        "endMs": 10000
      },
      "expected": {
        "required": {
          "entities": [
            {
              "type": "SPORTS_TEAM",
              "value": "Palmeiras"
            }
          ],
          "topics": [
            "football"
          ],
          "objects": [
            "football_jersey"
          ]
        }
      }
    }
  ]
}
